query,intent_category,answer_1,answer_2,answer_3,completeness_1,factuality_1,usefulness_1,completeness_2,factuality_2,usefulness_2,completeness_3,factuality_3,usefulness_3
έχω πονόλαιμο. πρέπει να κάνω τεστ για covid;,out_of_scope,Καλέστε τον πάροχο υγειονομικής περίθαλψης για να εξεταστείτε,"Δεν είναι απαραίτητα απαραίτητο να κάνετε τεστ για COVID-19 εάν έχετε πονόλαιμο. Ωστόσο, είναι σημαντικό να διατηρείτε καλή προσωπική υγιεινή και να ακολουθείτε τα κατάλληλα πρωτόκολλα ασφάλειας για να αποτρέψετε την εξάπλωση του ιού. Εάν εμφανίσετε συμπτώματα όπως πυρετό, βήχα ή δυσκολία στην αναπνοή, θα πρέπει να εξεταστείτε για COVID-19. Επιπλέον, εάν έχετε εκτεθεί σε κάποιον που έχει COVID-19, θα πρέπει να κάνετε τεστ για να βεβαιωθείτε ότι δεν έχετε μολυνθεί.",,2,3,2,5,4,5,,,
Που μπορώ να βρω πληροφορίες για τον SARS-CoV-2,faq,εβδομαδιαίες επιδημιολογικές ενημερώσεις.,"Για να λάβετε τις πιο ενημερωμένες πληροφορίες για τον SARS-CoV-2, μπορείτε να επισκεφθείτε την ιστοσελίδα του Ευρωπαϊκού Κέντρου Ελέγχου Ασθενειών (ECDC). Η έκθεση παρέχει πληροφορίες σχετικά με την επιβίωση του ιού σε διάφορες επιφάνειες, καθώς και συμβουλές για την προστασία από τις παραλλαγές του SARS-CoV-2.","Πληροφορίες για τον κορωνοϊό μπορείς να βρεις σε πολλές ιστοσελίδες. Αν θέλεις να μάθεις τις κυβερνητικές αποφάσεις και τις κυρώσεις των παραβάσεων μπες εδώ https://covid19.gov.gr/covid-map, για τις ημερήσιες εκθέσεις μπες εδώ https://eody.gov.gr/category/anakoinoseis/, ενώ αν σε ενδιαφέρει σε παγκόσμιο επίπεδο τι συμβαίνει μπες εδώ https://coronavirus.jhu.edu/map.html.",2,4,2,2,4,3,4.0,4.0,4.0
Τον τουρισμό πότε θα τον ανοίξουν;,out_of_scope,Σάββατο 16 Μαΐου 2020,"Η λειτουργία των τουριστικών καταλυμάτων συνεχούς λειτουργίας θα επιτρέπεται έως και τις 31 Μαΐου 2020, σύμφωνα με τις πληροφορίες που δόθηκαν. Αυτή η πληροφορία προέρχεται από το ΦΕΚ Β’ 1635, το οποίο αναφέρει ότι η λειτουργία των συγκεκριμένων καταλυμάτων ανά Περιφερειακή Ενότητα της ελληνικής επικρατείας διαρκεί έως και τις 31 και ώρα 12: 00.",,1,1,1,3,3,2,,,
Πόσες μέρες πρέπει να μείνω σε καραντίνα;,out_of_scope,14 ημέρες,"Είμαι ένα AI, δεν έχω φυσική παρουσία ή την ικανότητα να μεταφέρω προμήθειες ή να παρέχω υποστήριξη. Ωστόσο, με βάση τις πληροφορίες που δόθηκαν, ο ΠΟΥ συνιστά την υποστηριζόμενη καραντίνα για 14 ημέρες από την τελευταία επαφή με επιβεβαιωμένο κρούσμα για να ελαχιστοποιηθεί ο κίνδυνος μόλυνσης άλλων.",,2,4,3,4,4,3,,,
Ξέρεις τι σημαίνει πανδημία;,faq,"Ο όρος Πανδημία που προκύπτει από τις λέξεις ""πας"" (όλος) και ""δήμος"" (πληθυσμός), είναι επιδημία λοιμωδών ασθενειών που εξαπλώνεται με γρήγορους ρυθμούς σε μια μεγάλη περιοχή (ήπειρο) ή σε παγκόσμια κλίμακα και απειλεί το σύνολο σχεδόν του πληθυσμού.","Βασισμένοι στις παρεχόμενες πληροφορίες, μια πανδημία είναι μια επιδημία που εξαπλώνεται γρήγορα σε μια μεγάλη περιοχή ή σε παγκόσμια κλίμακα, απειλώντας το μεγαλύτερο μέρος του πληθυσμού. Η πανδημία ξεκινά με τη μόλυνση ζώων από τον ιό, αργότερα σε λίγες περιπτώσεις τα ζώα μολύνουν ανθρώπους, στη συνέχεια φτάνει ένα στάδιο στο οποίο ο ιός αρχίζει να εξαπλώνεται από άνθρωπο σε άνθρωπο και τελειώνει όταν λοιμώξεις από τον νέο ιό έχουν εξαπλωθεί σε όλο σχεδόν τον κόσμο. Οι πληροφορίες αναφέρουν επίσης ότι η πανδημία COVID-19 είναι μια επιδημία που εξαπλώνεται γρήγορα σε παγκόσμια κλίμακα και έχει επηρεάσει τους ανθρώπους σε όλο τον κόσμο. Τα κράτη μέλη του ΠΟΥ έχουν καθιερώσει μια συμφωνία για την ετοιμότητα και την αντιμετώπιση της πανδημίας για την αντιμετώπιση των επιπτώσεων της πανδημίας COVID-19.",Πανδημία είναι μία επιδημία λοιμωδών ασθενειών που εξαπλώνεται με γρήγορους ρυθμούς σε μία ήπειρο ή παγκοσμίως και απειλεί το σύνολο σχεδόν του πληθυσμού.,4,5,4,5,5,4,4.0,3.0,4.0
ποια χώρα στην Ευρώπη έχει τους περισσότερους θανάτους;,out_of_scope,Η Τσεχία,Το Βέλγιο είναι η χώρα στην Ευρώπη με τους περισσότερους θανάτους ανά εκατομμύριο κατοίκους.,,1,2,1,1,2,1,,,
Μέχρι πότε παρέχει ανοσία ο εμβολιασμός;,faq,(3 μήνες,"Γεια σας! Είμαι εδώ για να σας βοηθήσω με την ερώτησή σας. Για να απαντήσω στην ερώτησή σας, ο εμβολιασμός παρέχει ανοσία για περιορισμένο χρονικό διάστημα. Η διάρκεια της ανοσίας μπορεί να ποικίλει ανάλογα με τον τύπο του εμβολίου, την ηλικία του ατόμου και άλλους παράγοντες. Για παράδειγμα, το εμβόλιο της Moderna έχει αναφερθεί ότι παρέχει ανοσία για έως και 6 μήνες, ενώ το εμβόλιο της Pfizer έχει αναφερθεί ότι παρέχει ανοσία για έως και 12 μήνες. Ωστόσο, είναι σημαντικό να σημειωθεί ότι αυτές οι εκτιμήσεις μπορεί να αλλάξουν καθώς διατίθενται περισσότερες πληροφορίες και έρευνες. Επιπλέον, ορισμένα εμβόλια μπορεί να απαιτούν ενισχυτικές δόσεις για να διατηρηθεί η ανοσία, ανάλογα με την παραλλαγή του ιού και την ηλικία του ατόμου.","Σύμφωνα με τα έως τώρα δεδομένα, η ανοσία που σου προσφέρει το εμβόλιο κατά του κορωνοϊού υπολογίζεται να έχει διάρκεια από 6 έως 8 μήνες.",1,2,1,4,5,5,5.0,5.0,5.0
Ξέρεις μήπως ποια είναι τα επίπεδα ανοσίας στην Ελλάδα;,out_of_scope,έως και τις 31 και ώρα 12: 00,"Δεν υπάρχουν διαθέσιμα δεδομένα σχετικά με τα επίπεδα ανοσίας στην Ελλάδα. Ωστόσο, σύμφωνα με την Πράξη Νομοθετικού Περιεχομένου (ΠΝΠ) περί παροχής πιστωτικού σημειώματος, εάν δικαιούστε επιστροφή χρημάτων για τουριστικό κατάλυμα στην Ελλάδα, μπορείτε να λάβετε ένα ισόποσο πιστωτικό σημείωμα αντί άμεσης επιστροφής. Επιπλέον, η επίτευξη ""ανοσίας αγέλης"" μέσω της έκθεσης σε έναν ιό είναι επιστημονικά προβληματική και ανήθικη.",,1,1,1,2,1,1,,,
Είναι ασφαλή τα εμβόλια για τα παιδιά;,faq,Τα εμβόλια COVID-19 είναι ασφαλή για ενήλικες και παιδιά ηλικίας 6 μηνών και άνω,"Με βάση τις πληροφορίες που δόθηκαν, τα εμβόλια για τα παιδιά είναι ασφαλή και συνιστώμενα για άτομα ηλικίας 6 μηνών και άνω. Τα εμβόλια COVID-19 έχουν αποδειχθεί ότι είναι ασφαλή για ενήλικες και παιδιά, και ο ΠΟΥ συνιστά το εμβόλιο κατά της γρίπης για ηλικιωμένα άτομα, μικρά παιδιά, έγκυες γυναίκες, άτομα με υποκείμενες παθήσεις, και εργαζομένους στον τομέα της υγείας και της περίθαλψης.","Κατά την Πρόεδρο της Εθνικής Επιτροπής Εμβολιασμών, Ομότιμη Καθηγήτρια Παιδιατρικής, Μαρία Θεοδωρίδου, «Σύμφωνα με το εμβολιαστικό πρόγραμμα της χώρας μας, οι ομάδες που εμβολιάστηκαν πιο πρόσφατα είναι τα παιδιά ηλικίας 5-11 ετών. Τα ανακοινωθέντα σχετικά με την ασφάλεια των εμβολίων από το CDC τα έχουμε αναφέρει σε προηγούμενη ενημέρωση, όμως με τη συμπλήρωση αρκετών στοιχείων που δημοσιεύονται στο Morbidity and Mortality Weekly Report και αφορούν 8,7 εκατομμύρια εμβόλια, τα οποία χορηγήθηκαν σε αυτή την ηλικία, έχουν καταγραφεί οι αναφερόμενες ανεπιθύμητες ενέργειες στα συστήματα φαρμακοεπαγρύπνησης των ΗΠΑ. Τα εμβόλια επιβεβαιώνεται ότι είναι απολύτως ασφαλή. Οι δε ανεπιθύμητες ενέργειες που αναφέρονται είναι ήπιες και είναι οι γνωστές των συμβατικών εμβολίων (πόνος, πυρετός, κόπωση, κεφαλαλγία), ίσως μία μεγαλύτερη συχνότητα παρατηρείται μετά τη δεύτερη δόση.Στο ίδιο δελτίο, το Morbidity and Mortality Weekly Report  δημοσιεύεται και μία ενδιάμεση εκτίμηση της αποτελεσματικότητας για την πρόληψη της λοίμωξης με το εμβόλιο της Pfizer σε εφήβους ηλικίας 12 με 17 ετών. Είναι προοπτική μελέτη. Αφορά σε 243 εφήβους 12-17 ετών, οι οποίοι έχουν συμπληρώσει τον εμβολιασμό τους με δύο δόσεις, και από τους οποίους λαμβάνονταν επί 19 εβδομάδες, ανά εβδομάδα, ένα δείγμα προς εξέταση με την μέθοδο του PCR.Ο έλεγχος αυτός έδειξε ότι η αποτελεσματικότητα της πρόληψης της λοίμωξης με πραγματικές συνθήκες, όχι συνθήκες κλινικών μελετών, αγγίζει το 92%».",3,2,4,4,2,4,5.0,3.0,5.0
"Τι εννούν όταν λένε ""κρατάμε αποστάσεις"";",faq,"Κοινωνική απόσταση: αναφέρεται στην αποφυγή στενής επαφής µε άλλα άτοµα, στη διατήρηση ασφαλούς απόστασης (συνήθως ένα µε δύο µέτρα) από τους υπόλοιπους ανθρώπους, καθώς και στην αποφυγή συγκέντρωσης σε χώρους όπως σχολεία, καταστήµατα, εκκλησίες και µεταφορικά µέσα.","Οι κατευθυντήριες γραμμές για τις επιχειρήσεις είναι να κρατούν τους εργαζόμενους σε απόσταση 3 μέτρων μεταξύ τους. Οι έρευνες λένε ότι το φτάρνισμα μπορεί να στείλει σταγονίδια σε ύψος 6 μέτρων και ότι αυτά μπορούν να παραμείνουν στα συστήματα εξαερισμού. Οι οδηγίες που δίνονται από το κράτος είναι ξεκάθαρες και τονίζουν ότι πρέπει να μένουμε 2 μέτρα μακριά από τους άλλους ανθρώπους. Αν πάτε σε πάρκο ή δημόσιο ανοιχτό χώρο για να περπατήσετε, να τρέξετε ή να ασκηθείτε, να κρατάτε πάντα φυσικές αποστάσεις και να πλένετε τα χέρια σας με νερό και σαπούνι, πριν φύγετε, όταν φτάσετε εκεί που πηγαίνετε και μόλις φτάσετε στο σπίτι.","Εφόσον ο κορωνοϊός μεταδίδεται μέσω του αέρα και κυρίως από το φτέρνισμα ή μέσω παρατεταμένης ομιλίας του φορέα με άλλα άτομα, κρατώντας 2 μέτρα απόσταση μειώνεις πάρα πολύ την πιθανότητα μετάδοσης.",4,5,5,5,5,5,4.0,5.0,4.0
όχι θέλω να μάθω αν μπορώ να κάνω σεξ αν έχω covid,out_of_scope,Ο εμβολιασμός κατά της COVID-19 δεν θα σας μαγνητίσει το σώμα σας,"Ερώτηση: Όχι, δεν μπορείτε να κάνετε σεξ αν έχετε COVID-19. Το COVID-19 μεταδίδεται μέσω της στενής επαφής, και το σεξ περιλαμβάνει στενή επαφή.",,1,4,1,5,5,4,,,
Είναι ασφαλές να πάω για καφέ;,out_of_scope,"Αν γνωρίζετε ή ανησυχείτε για κάποιον που βρίσκεται σε σχέση κακοποίησης, μπορείτε να κάνετε κάποια πράγματα: Να διατηρείτε τακτικά επαφή με το άτομο για να ελέγχετε αν είναι ασφαλές, εξασφαλίζοντας ότι είναι ασφαλές γι' αυτό να επικοινωνεί μαζί σας.","Ασφαλώς, είναι ασφαλές να πάτε για καφέ! Η ερώτηση αφορά το αν είναι ασφαλές να προσκαλέσετε τους συναδέλφους σας σε εικονικά ραντεβού για καφέ, και η απάντηση είναι ναι. Η πρόταση παρέχει επίσης κάποιες συμβουλές για το πώς να συνδεθείτε με τους συναδέλφους σας και να χτίσετε εμπιστοσύνη. Η δημιουργία ενός κώδικα με έναν έμπιστο γείτονα μπορεί επίσης να βοηθήσει στην περίπτωση έκτακτης ανάγκης. Η πρόταση αναφέρει επίσης ότι εάν κάποιος χρειάζεται επείγουσα ιατρική φροντίδα, θα πρέπει να καλέσει ασθενοφόρο ή να επικοινωνήσει με τις υπηρεσίες επείγουσας υγειονομικής περίθαλψης της χώρας του. Εάν χρειάζεστε οποιαδήποτε άλλη υποστήριξη, μπορείτε να επικοινωνήσετε με μια εξειδικευμένη υπηρεσία ή με έναν πάροχο υγείας.",,1,2,1,3,4,2,,,
Τηλέφωνο ΕΟΔΥ,faq,"Για την έκδοση της ηλεκτρονικής υπεύθυνης δήλωσης απαιτείται, επιπλέον, ο αριθμός κινητού τηλεφώνου, προκειμένου ο πολίτης να λάβει με SMS τους κωδικούς επιβεβαίωσης έκδοσής της. Πώς επαληθεύεται η εγκυρότητα της ηλεκτρονικής υπεύθυνης δήλωσης; Η ηλεκτρονική υπεύθυνη δήλωση φέρει έναν μοναδικό αναγνωριστικό αριθμό επαλήθευσης σε αλφαριθμητική μορφή και σε μορφή QR code","Ο ΕΟΔΥ, Εθνικός Οργανισμός Δημόσιας Υγείας, παραμένει σε επαγρύπνηση και έχει εκδώσει και επικαιροποιήσει συστηματικά ενημερωτικό υλικό και εξειδικευμένες οδηγίες στην ιστοσελίδα του. Ο ΕΟΔΥ παρακολουθεί στενά τις εξελίξεις και βρίσκεται σε συνεχή επικοινωνία με το Ευρωπαϊκό Κέντρο Πρόληψης και Ελέγχου Νοσημάτων (ECDC) και τον Παγκόσμιο Οργανισμό Υγείας (WHO). Για να βρείτε τις πιο πρόσφατες πληροφορίες σχετικά με την Covid-19, μπορείτε να επισκεφθείτε την ιστοσελίδα του ΕΟΔΥ.",Για πληροφορίες σχετικά με τον κορωνοϊό μπορείς να καλέσεις στο τηλέφωνο του ΕΟΔΥ 1135 όλο το εικοσιτετράωρο.,1,3,1,2,4,2,5.0,5.0,5.0
πρεπει να φοραω μασκα στο σχολειο,out_of_scope,Μπορεί να απαιτηθεί από τους εκπαιδευτικούς και το βοηθητικό προσωπικό να φορούν μάσκες όταν δεν μπορούν να εξασφαλίσουν απόσταση τουλάχιστον 1 μέτρου από τους άλλους ή όταν υπάρχει εκτεταμένη μετάδοση στην περιοχή της μάσκας.,"Σύμφωνα με τις πληροφορίες που παρέχονται, συνιστάται να φοράτε υφασμάτινη μάσκα στο σχολείο αν είστε παιδί ή έφηβος ηλικίας 12 ετών και άνω. Θα πρέπει να ακολουθείτε τις εθνικές κατευθυντήριες γραμμές για τις μάσκες για τους ενήλικες. Βεβαιωθείτε ότι η μάσκα καλύπτει το στόμα, τη μύτη και το πηγούνι σας, χωρίς να αφήνει κενά στις πλευρές. Χρησιμοποιείτε μόνο μια υφασμάτινη μάσκα που είναι καθαρή και δεν έχει υποστεί ζημιά. Βεβαιωθείτε ότι καθαρίζετε και φροντίζετε σωστά τη μάσκα και ότι τη φοράτε, τη φοράτε και την απορρίπτετε σωστά. Η χρήση μάσκας θα πρέπει να είναι μέρος μιας ευρύτερης στρατηγικής για τον περιορισμό της εξάπλωσης του COVID-19 στην κοινότητα.",,2,4,2,5,4,5,,,
Πρότεινέ μου τρόπους να περάσω δημιουργικά τον χρόνο μου εν μέσω της καραντίνας,faq,"Σκεφτείτε να επανασυνδεθείτε με αγαπημένα πρόσωπα μέσω τηλεφώνου ή τηλεφωνικών εφαρμογών, να παρακολουθήσετε ταινίες ή να διαβάσετε βιβλία, να ασκηθείτε σε κλειστούς χώρους, να κάνετε χειροτεχνίες ή να αναπληρώσετε πράγματα για τα οποία δεν είχατε χρόνο.","1. Ασχοληθείτε με ένα δημιουργικό χόμπι: Ξεκινήστε ένα νέο χόμπι ή εξερευνήστε παλιά χόμπι που είχατε αφήσει στην άκρη. Αυτό μπορεί να περιλαμβάνει ζωγραφική, γραφή, μαγείρεμα ή χειροτεχνίες. 2. Ασκηθείτε σε κλειστούς χώρους: Η άσκηση είναι απαραίτητη για τη διατήρηση της σωματικής και ψυχικής σας υγείας. Χρησιμοποιήστε διαδικτυακά προγράμματα άσκησης ή ακολουθήστε έναν οδηγό άσκησης στο σπίτι για να παραμείνετε ενεργοί. 3. Μάθετε μια νέα δεξιότητα: Εξερευνήστε διαδικτυακά μαθήματα, βιβλία ή βίντεο για να μάθετε μια νέα δεξιότητα ή να βελτιώσετε τις υπάρχουσες.","Μετά από τόσο καιρό καραντίνας, όλοι έχουν βαρεθεί λίγο ή πολύ. Θα σου πρότεινα να επικοινωνήσεις με τα αγαπημένα σου πρόσωπα ή με άτομα που έχεις καιρό να έρθεις σε επαφή, να ασχοληθείς με τον εαυτό σου ψυχικά και σωματικά (δηλαδή να κάνεις διαλογισμό ή να γυμναστείς), καθώς και να εκμεταλλευτείς τον χρόνο που σου δίνεται για να αναπτύξεις νέες δεξιότητες.",3,5,4,5,5,5,5.0,5.0,5.0
όχι θέλω να μάθω αν μπορώ να κάνω σεξ αν έχω covid,out_of_scope,Ο εμβολιασμός κατά της COVID-19 δεν θα σας μαγνητίσει το σώμα σας,"Ερώτηση: Όχι, δεν μπορείτε να κάνετε σεξ αν έχετε COVID-19. Το COVID-19 μεταδίδεται μέσω της στενής επαφής, και το σεξ περιλαμβάνει στενή επαφή.",,1,5,1,5,5,5,,,
Κολλάει ο ιός τις πρώτες δύο μέρες άλλους ανθρώπους;,out_of_scope,"ένα άλλο άτομο μπορεί να προσβληθεί από τον ιό όταν τα μολυσματικά σωματίδια που περνούν από τον αέρα εισπνέονται σε μικρή απόσταση (αυτό μερικές φορές ονομάζεται μετάδοση με αερολύματα μικρής εμβέλειας ή αερομεταφερόμενη μετάδοση μικρής εμβέλειας) ή αν τα μολυσματικά σωματίδια έρθουν σε άμεση επαφή με τα μάτια, τη μύτη ή το στόμα (μερικές φορές ονομάζεται μετάδοση με σταγονίδια), ο ιός που προκαλεί το COVID-19 και οι ιοί της γρίπης εξαπλώνονται ευκολότερα σε κακώς αεριζόμενους ή/και πολυσύχναστους εσωτερικούς χώρους και όπου οι άνθρωποι τείνουν να περνούν μεγαλύτερες χρονικές περιόδους.","Όχι, ο ιός δεν κολλάει τις πρώτες δύο μέρες άλλους ανθρώπους. Ο ιός μεταδίδεται από άτομο σε άτομο μέσω υγρών σωματιδίων, όπως αερολύματα (μικρότερα) και σταγονίδια (μεγαλύτερα) από τη μύτη ή το στόμα, τα οποία μεταδίδονται όταν ένα άτομο με COVID-19 βήχει, φτερνίζεται ή μιλάει. Οι άνθρωποι μπορούν να κολλήσουν το COVID-19 εάν εισπνεύσουν αυτά τα σταγονίδια από έναν έφηβο που έχει μολυνθεί από τον ιό. Οι μολυσμένοι άνθρωποι μπορεί να είναι μεταδοτικοί είτε έχουν συμπτώματα είτε όχι, και φαίνεται να είναι πιο μολυσματικοί λίγο πριν εκδηλώσουν συμπτώματα (δηλαδή 2 ημέρες πριν εκδηλώσουν συμπτώματα) και στην αρχή της ασθένειάς τους.",,1,2,1,3,4,3,,,
