query,intent_category,answer_1,answer_2,answer_3,completeness_1,factuality_1,usefulness_1,completeness_2,factuality_2,usefulness_2,completeness_3,factuality_3,usefulness_3
Το pfizer κυκλοφορεί επίσημα;,faq,"Το εμβόλιο COVID‑19 των Pfizer – BioNTech (INN:tozinameran), με κωδική ονομασία BNT162b2, διανέμεται με την επωνυμία Comirnaty, είναι ένα mRNA εμβόλιο κατά της λοίμωξης COVID-19 που αναπτύχθηκε από τη γερμανική εταιρεία BioNTech σε συνεργασία με την αμερικανική εταιρεία Pfizer.","Το Pfizer κυκλοφορεί επίσημα ως Comirnaty, το οποίο εγκρίθηκε από την Ευρωπαϊκή Επιτροπή και έγινε το πέμπτο εγκεκριμένο εμβόλιο COVID-19 στην Ευρωπαϊκή Ένωση. Είναι το πρώτο εμβόλιο COVID-19 που εγκρίθηκε για χρήση έκτακτης ανάγκης και το πρώτο που εγκρίθηκε για τακτική χρήση.","Αυτή τη στιγμή υπάρχουν διαθέσιμα εμβόλια κατά του κορωνοϊού στη χώρα μας. Προς το παρόν, τα εμβόλια κατά του κορωνοϊού που έχουν εγκριθεί στην Ευρώπη είναι το Pfizer-BioNTech, το Moderna, το Astra Zeneca και το Johnson and Johnson's Janssen.",2,4,3,4,4,4,4.0,4.0,4.0
Πόσο διάστημα μεσολαβεί μεταξύ 2ης και 3ης δόσης;,faq,12 έως 48 ώρες,"Το διάστημα μεταξύ της δεύτερης και τρίτης δόσης ενός εμβολίου εξαρτάται από το συγκεκριμένο εμβόλιο και τη χώρα. Για παράδειγμα, το εμβόλιο HPV που απαιτεί δύο δόσεις μπορεί να ξεκινήσει οποιαδήποτε στιγμή μεταξύ 9 και 14 ετών, και το διάστημα μεταξύ των δόσεων μπορεί να είναι μεγαλύτερο, όπως 12 ή 15 μήνες. Σε άλλες περιπτώσεις, το ελάχιστο διάστημα μεταξύ των δόσεων είναι 6 μήνες, αλλά μπορεί να είναι 12 ή 15 μήνες και, εάν είναι απαραίτητο, ακόμη περισσότερο. Είναι σημαντικό να συμβουλευτείτε τις τοπικές κατευθυντήριες γραμμές και να ακολουθήσετε το συνιστώμενο χρονοδιάγραμμα για να βεβαιωθείτε ότι είστε πλήρως προστατευμένοι.","Χορήγηση της τρίτης αναμνηστικής δόσης σε όλους τους πολίτες 18 και άνω, τρεις μήνες μετά την ολοκλήρωση του εμβολιασμού τους με δύο δόσεις. Σε περίπτωση προηγηθείσας νόσου Covid-19 ο εμβολιασμός συστήνεται 3 μήνες μετά τη διάγνωσή της.",1,1,1,2,3,2,2.0,2.0,2.0
Τι κάνω εάν έρθω σε επαφή με κρούσμα,out_of_scope,συνεχίσουν να λαμβάνουν τις συνήθεις προφυλάξεις και να προσέρχονται στην εργασία τους ως συνήθως,"Εάν έρθετε σε επαφή με κρούσμα, θα πρέπει να ακολουθήσετε τα παρακάτω βήματα:  1. Αυτο-παρακολούθηση: Παρακολουθήστε την υγεία σας για 14 ημέρες μετά την επαφή με το κρούσμα. Εάν εμφανίσετε συμπτώματα, όπως πυρετό, βήχα ή δυσκολία στην αναπνοή, θα πρέπει να απομονωθείτε και να κάνετε τεστ για COVID-19. 2. Απομόνωση: Εάν δεν έχετε συμπτώματα, θα πρέπει να απομονωθείτε για 14 ημέρες μετά την τελευταία επαφή με το κρούσμα. Αποφύγετε την επαφή με άλλους, μείνετε σπίτι, και αποφύγετε να χρησιμοποιείτε κοινόχρηστους χώρους ή δημόσιες συγκοινωνίες.",,1,3,1,4,4,4,,,
Πότε θα τελείωσει η πανδημία του κορωνοϊού;,faq,2021,"Δεν μπορεί να δοθεί μια ακριβής ημερομηνία για το τέλος της πανδημίας του κορωνοϊού. Ωστόσο, με την πρόοδο των εμβολιασμών και την εξέλιξη των ιατρικών θεραπειών, οι ειδικοί προβλέπουν ότι η πανδημία θα μπορούσε να τεθεί υπό έλεγχο μέχρι το 2024. Είναι σημαντικό να σημειωθεί ότι η εξέλιξη της πανδημίας εξαρτάται από διάφορους παράγοντες, συμπεριλαμβανομένων της διαθεσιμότητας εμβολίων, της αποτελεσματικότητας των θεραπειών και της συμπεριφοράς των ανθρώπων.","Το μόνο σίγουρο είναι ότι θα τελειώσει. Η πανδημία της ισπανικής γρίπης ξεκίνησε την άνοιξη του 1918 και ιστορικές αναφορές να θέλουν να παρατείνεται μέχρι τον χειμώνα του 1920. Υπολογίζεται ότι το 1/3 του πληθυσμού της υφηλίου κόλλησε τον ιό, που συγγενεύει μερικώς με τον γνωστό και σε εμάς Η1Ν1, ο οποίος προκάλεσε επιδημία και το 2009. Η πορεία του ιού είναι σχετικώς απρόβλεπτη παρά τα υπάρχοντα μοντέλα πρόβλεψης της εξέλιξης της πανδημίας. Το αισιόδοξο σενάριο τοποθετεί το τέλος της μέσα στο 2022 εφόσον οι εμβολιασμοί παγκοσμίως ξεπεράσουν το 70%.",1,1,1,4,5,4,4.0,5.0,5.0
Τι κάνω εάν έρθω σε επαφή με κρούσμα,out_of_scope,συνεχίσουν να λαμβάνουν τις συνήθεις προφυλάξεις και να προσέρχονται στην εργασία τους ως συνήθως,"Εάν έρθετε σε επαφή με κρούσμα, θα πρέπει να ακολουθήσετε τα παρακάτω βήματα:  1. Αυτο-παρακολούθηση: Παρακολουθήστε την υγεία σας για 14 ημέρες μετά την επαφή με το κρούσμα. Εάν εμφανίσετε συμπτώματα, όπως πυρετό, βήχα ή δυσκολία στην αναπνοή, θα πρέπει να απομονωθείτε και να κάνετε τεστ για COVID-19. 2. Απομόνωση: Εάν δεν έχετε συμπτώματα, θα πρέπει να απομονωθείτε για 14 ημέρες μετά την τελευταία επαφή με το κρούσμα. Αποφύγετε την επαφή με άλλους, μείνετε σπίτι, και αποφύγετε να χρησιμοποιείτε κοινόχρηστους χώρους ή δημόσιες συγκοινωνίες.",,2,2,1,5,5,5,,,
Ταξίδι;,out_of_scope,3.,"Σίγουρα! Θα χαρώ πολύ να βοηθήσω. Με βάση τις πληροφορίες που δόθηκαν, θα έλεγα ότι η απάντηση στην ερώτηση ""Ταξίδι;"" είναι:  Η απάντηση είναι:  * **Φορέστε συνεχώς μάσκα ενώ ταξιδεύετε** * **Καθαρίζετε τακτικά τα χέρια σας με απολυμαντικό χεριών** * **Καλύψτε το βήχα ή το φτέρνισμα με έναν λυγισμένο αγκώνα ή ένα χαρτομάντιλο** * **Διατηρείτε απόσταση από τους άλλους όπου είναι δυνατόν**  Αυτές είναι όλες χρήσιμες συμβουλές για να βοηθήσετε στην πρόληψη της εξάπλωσης των μικροβίων και στη μείωση του κινδύνου ασθένειας κατά τη διάρκεια του ταξιδιού σας.",,1,1,1,4,4,4,,,
Πόσο διάστημα μεσολαβεί μεταξύ 2ης και 3ης δόσης;,faq,12 έως 48 ώρες,"Το διάστημα μεταξύ της δεύτερης και τρίτης δόσης ενός εμβολίου εξαρτάται από το συγκεκριμένο εμβόλιο και τη χώρα. Για παράδειγμα, το εμβόλιο HPV που απαιτεί δύο δόσεις μπορεί να ξεκινήσει οποιαδήποτε στιγμή μεταξύ 9 και 14 ετών, και το διάστημα μεταξύ των δόσεων μπορεί να είναι μεγαλύτερο, όπως 12 ή 15 μήνες. Σε άλλες περιπτώσεις, το ελάχιστο διάστημα μεταξύ των δόσεων είναι 6 μήνες, αλλά μπορεί να είναι 12 ή 15 μήνες και, εάν είναι απαραίτητο, ακόμη περισσότερο. Είναι σημαντικό να συμβουλευτείτε τις τοπικές κατευθυντήριες γραμμές και να ακολουθήσετε το συνιστώμενο χρονοδιάγραμμα για να βεβαιωθείτε ότι είστε πλήρως προστατευμένοι.","Χορήγηση της τρίτης αναμνηστικής δόσης σε όλους τους πολίτες 18 και άνω, τρεις μήνες μετά την ολοκλήρωση του εμβολιασμού τους με δύο δόσεις. Σε περίπτωση προηγηθείσας νόσου Covid-19 ο εμβολιασμός συστήνεται 3 μήνες μετά τη διάγνωσή της.",1,1,1,5,5,5,5.0,5.0,5.0
τι είναι το mrna;,out_of_scope,mRNA-1283,"Το mRNA, ή αγγελιοφόρο RNA, είναι ένα μόριο που μεταφέρει γενετικές οδηγίες από το DNA στα κύτταρα. Στο πλαίσιο των εμβολίων COVID-19, το mRNA που χρησιμοποιείται στα εμβόλια Moderna και Pfizer περιέχει οδηγίες για την παραγωγή πρωτεϊνών ακίδας του SARS-CoV-2, οι οποίες είναι σημαντικές για την ανοσοαπόκριση. Τα εμβόλια RNA χρησιμοποιούν νανοσωματίδια λιπιδίων για να προστατεύσουν το mRNA και να διευκολύνουν την απορρόφησή του από τα κύτταρα, και όταν τα κύτταρα προσλάβουν το mRNA, το χρησιμοποιούν για να παράγουν πρωτεΐνες ακίδας. Αυτές οι πρωτεΐνες αναγνωρίζονται από το ανοσοποιητικό σύστημα, το οποίο παράγει αντισώματα και Τ κύτταρα για να πολεμήσουν τον ιό.",,1,2,1,4,5,4,,,
Aυξάνει τον κίνδυνο εμφάνισης σακχαρώδη διαβήτη στα παιδιά η COVID-19;,faq,πολυσυστηματικό φλεγμονώδες σύνδρομο στα παιδιά (MIS-C) είναι μια σοβαρή επιπλοκή της νόσου.,"Η COVID-19 δεν αυξάνει άμεσα τον κίνδυνο εμφάνισης σακχαρώδη διαβήτη στα παιδιά. Ωστόσο, το γεγονός ότι οι ηλικιωμένοι και τα άτομα με υποκείμενα νοσήματα διατρέχουν υψηλότερο κίνδυνο σοβαρής νόσου και θανάτου μπορεί να επηρεάσει την υγεία των παιδιών αν έρθουν σε επαφή με αυτά τα άτομα. Επιπλέον, οι μακροπρόθεσμες επιπτώσεις της COVID-19 στα παιδιά, όπως η εμφάνιση πολυσυστηματικού φλεγμονώδους συνδρόμου, δεν είναι ακόμα πλήρως κατανοητές. Είναι σημαντικό να τηρούνται τα μέτρα πρόληψης της μετάδοσης και να συνεχίζονται τα προγράμματα εμβολιασμού για την πρόληψη της εξάπλωσης της νόσου και των πιθανών κινδύνων που σχετίζονται με αυτήν.","Σύμφωνα με ενημέρωση του ΕΚΠΑ, «Έχει φανεί από νωρίς ότι η παρουσία σακχαρώδη διαβήτη αυξάνει τον κίνδυνο για COVID-19, ενώ επηρεάζει αρνητικά την έκβαση της νόσου. Πράγματι, αρκετές μελέτες έχουν καταδείξει ότι η αναλογία ασθενών με σακχαρώδη διαβήτη είναι μεγαλύτερη μεταξύ αυτών με σοβαρή COVID-19, εκείνων δηλαδή που χρειάζονται νοσηλεία σε νοσοκομείο ή διασωλήνωση. Επίσης, υψηλά ποσοστά σακχαρώδη διαβήτη έχουν καταγραφεί μεταξύ ασθενών που κατέληξαν από COVID-19. Ενδιαφέρον έχει ότι υπάρχει σαφής συσχέτιση μεταξύ της γλυκαιμικής ρύθμισης και της σοβαρότητας της νόσου. Ο κίνδυνος για σοβαρή COVID-19 είναι υψηλότερος σε άτομα με υψηλή γλυκοζυλιωμένη αιμοσφαιρίνη (HbA1c) πριν από τη λοίμωξη. Όταν η HbA1c μειώνεται, ο κίνδυνος για εμφάνιση σοβαρής νόσησης μειώνεται επίσης. Από την άλλη, έχει φανεί ότι η νόσος COVID-19 μπορεί να απορρυθμίσει το μεταβολισμό της γλυκόζης ειδικά σε άτομα με γνωστό σακχαρώδη διαβήτη ή προδιάθεση για διαβήτη. Υπήρχαν κάποιες ενδείξεις και ανησυχίες για την πιθανότητα εμφάνισης νέων περιπτώσεων σακχαρώδους διαβήτη. Μια πολύ πρόσφατη μελέτη του CDC στις ΗΠΑ φαίνεται να επιβεβαιώνει τις ανησυχίες αυτές και μάλιστα στα παιδιά. https://www.cdc.gov/mmwr/volumes/71/wr/mm7102e2.htm?s_cid=mm7102e2_w",1,2,1,4,4,3,3.0,5.0,2.0
Γνωρίζεις κάποιο τηλέφωνο για ψυχολογική υποστήριξη;,faq,Καλέστε τη γραμμή SOS 15900,"Σίγουρα! Μπορείτε να επικοινωνήσετε με τη γραμμή SOS 15900 της Γενικής Γραμματείας Οικογενειακής Πολιτικής και Ισότητας των Φύλων για ψυχοκοινωνική στήριξη, νομική συμβουλευτική και φιλοξενία σε ξενώνες. Μπορείτε επίσης να επικοινωνήσετε με τις Υπηρεσίες Αντιμετώπισης Ενδοοικογενειακής Βίας που λειτουργούν σε όλη την επικράτεια, μέσω τηλεφώνου ή μηνύματος ηλεκτρονικού ταχυδρομείου.","Αν έχεις την ανάγκη να μιλήσεις με κάποιον είναι καλή ιδέα να καλέσεις την τηλεφωνική γραμμή ψυχολογικής υποστήριξης του ΕΟΔΥ, ο αριθμός είναι 10306​.",3,4,3,4,4,4,4.0,4.0,4.0
Είναι ασφαλές να πάω για καφέ;,out_of_scope,"Αν γνωρίζετε ή ανησυχείτε για κάποιον που βρίσκεται σε σχέση κακοποίησης, μπορείτε να κάνετε κάποια πράγματα: Να διατηρείτε τακτικά επαφή με το άτομο για να ελέγχετε αν είναι ασφαλές, εξασφαλίζοντας ότι είναι ασφαλές γι' αυτό να επικοινωνεί μαζί σας.","Ασφαλώς, είναι ασφαλές να πάτε για καφέ! Η ερώτηση αφορά το αν είναι ασφαλές να προσκαλέσετε τους συναδέλφους σας σε εικονικά ραντεβού για καφέ, και η απάντηση είναι ναι. Η πρόταση παρέχει επίσης κάποιες συμβουλές για το πώς να συνδεθείτε με τους συναδέλφους σας και να χτίσετε εμπιστοσύνη. Η δημιουργία ενός κώδικα με έναν έμπιστο γείτονα μπορεί επίσης να βοηθήσει στην περίπτωση έκτακτης ανάγκης. Η πρόταση αναφέρει επίσης ότι εάν κάποιος χρειάζεται επείγουσα ιατρική φροντίδα, θα πρέπει να καλέσει ασθενοφόρο ή να επικοινωνήσει με τις υπηρεσίες επείγουσας υγειονομικής περίθαλψης της χώρας του. Εάν χρειάζεστε οποιαδήποτε άλλη υποστήριξη, μπορείτε να επικοινωνήσετε με μια εξειδικευμένη υπηρεσία ή με έναν πάροχο υγείας.",,1,2,1,2,3,3,,,
Σου έχουν πει τι συμπτώματα βγαίνουν από το εμβόλιο;,faq,Οι περισσότερες παρενέργειες υποχωρούν μέσα σε λίγες ημέρες από μόνες τους.,"Με βάση τις διαθέσιμες πληροφορίες, τα συμπτώματα που σχετίζονται με το εμβόλιο της AstraZeneca είναι πολύ σπάνια και εμφανίζονται σε περίπου τέσσερα έως έξι άτομα σε κάθε εκατομμύριο εμβολιασθέντων. Τα συμπτώματα μπορεί να περιλαμβάνουν πυρετό, πονοκέφαλο, ναυτία και μυϊκό πόνο. Είναι σημαντικό να σημειωθεί ότι αυτά τα συμπτώματα δεν υποδεικνύουν απαραίτητα ότι το εμβόλιο δεν λειτουργεί. Τα εμβολιασμένα άτομα μπορούν ακόμα να μολυνθούν από το COVID-19, αλλά είναι πολύ πιο πιθανό να εμφανίσουν ήπια συμπτώματα εάν μολυνθούν. Εάν εμφανίσετε επίμονο πόνο στο στήθος, δύσπνοια ή ταχυκαρδία ή ταχυπαλμία, είναι σημαντικό να επικοινωνήσετε αμέσως με τον γιατρό σας.","Πιθανά συμπτώματα τα οποία μπορεί να εμφανιστούν μετά τον εμβολιασμό είναι πόνος στους μυς και στο χέρι στο οποίο έγινε η ένεση, πυρετός, πονοκέφαλος και αδιαθεσία. Τα συμπτώματα αυτά θεωρούνται ελαφρά και προσωρινά. Συνήθως έχουν διάρκεια ενός εικοσιτετραώρου.",3,4,3,4,5,4,4.0,4.0,4.0
"Σε παρακαλώ πες μου αν εμφανίσω αλλεργία στην πρώτη δόση, θα κάνω τη δεύτερη με άλλο εμβόλιο;",faq,"Εάν σας προσφερθεί ένας διαφορετικός τύπος εμβολίου, μπορείτε να προχωρήσετε στον εμβολιασμό. Ανάλογα με τον τύπο του εμβολίου, η χρήση διαφορετικού τύπου εμβολίου μπορεί να παρέχει καλύτερη προστασία από τη χρήση του ίδιου τύπου εμβολίου. Μπορώ να εξακολουθήσω να λαμβάνω το COVID-19 αφού έχω εμβολιαστεί; Ναι.","Είναι ασφαλές να κάνετε το δεύτερο εμβόλιο COVID-19 με διαφορετικό τύπο εμβολίου από το πρώτο. Εάν εμφανιστεί αλλεργική αντίδραση στην πρώτη δόση, είναι πιθανό να αντιμετωπιστεί και να συνεχιστεί με το δεύτερο εμβόλιο με άλλο τύπο εμβολίου. Ωστόσο, είναι σημαντικό να συμβουλευτείτε έναν πάροχο υγειονομικής περίθαλψης για εξατομικευμένες συμβουλές και πιθανές προφυλάξεις ανάλογα με την ατομική κατάσταση υγείας και ιστορικό.","Ο εμβολιασμός με τη δεύτερη δόση θα πρέπει να πραγματοποιηθεί με το ίδιο εμβόλιο. Εξαίρεση μπορεί να αποτελέσουν περιπτώσεις όπως η εμφάνιση θρομβώσεων ή αλλεργικής αντίδρασης στην πρώτη δόση του εμβολίου, αλλά ακόμα και τότε, η έγκριση για διαφορετικό εμβόλιο θα πρέπει να προέλθει από ειδική επιτροπή.",2,4,2,4,4,3,3.0,5.0,5.0
Μπορεί να μεταδοθεί από κάποιον που το έχει περάσει;,out_of_scope,"Ακόμα και αν κάποιος που έχει μολυνθεί με COVID-19 περάσει από μια σήραγγα ή έναν θάλαμο απολύμανσης, μόλις αρχίσει να μιλάει, να βήχει ή να φτερνίζεται μπορεί ακόμα να μεταδώσει τον ιό","Ναι, είναι δυνατόν να μεταδοθεί από κάποιον που έχει αναρρώσει από COVID-19. Η μετάδοση μπορεί να συμβεί όταν το άτομο που έχει αναρρώσει αρχίζει να μιλάει, να βήχει ή να φτερνίζεται, απελευθερώνοντας σταγονίδια που περιέχουν τον ιό. Είναι σημαντικό να σημειωθεί ότι ενώ ορισμένες παραλλαγές του ιού μπορεί να είναι πιο μεταδοτικές, η ανίχνευση επαφών και η υποστηριζόμενη καραντίνα των επαφών είναι απαραίτητη για τον έλεγχο της εξάπλωσης του ιού. Οι υγειονομικές αρχές θα πρέπει να ενημερώνουν τα άτομα που μπορεί να είναι επαφές, και τα άτομα θα πρέπει να παρακολουθούν για συμπτώματα και να ακολουθούν τα πρωτόκολλα αυτο-απομόνωσης ή καραντίνας.",,2,4,2,2,3,3,,,
Για πόσο καιρό μεταδίδεται ο κορονοϊός;,out_of_scope,/4/ 2020,"Ο κορονοϊός μεταδίδεται κυρίως από άτομο σε άτομο μέσω σταγονιδίων του αναπνευστικού, όπως μέσω του βήχα, του φτερνίσματος ή της ομιλίας. Μπορεί επίσης να μεταδοθεί μέσω επαφής με μολυσμένες επιφάνειες ή αντικείμενα, όπως όταν αγγίζουμε μια επιφάνεια που έχει τον ιό και στη συνέχεια αγγίζουμε τα μάτια, τη μύτη ή το στόμα μας. Ο ιός μπορεί να επιβιώσει σε επιφάνειες για διαφορετικές χρονικές περιόδους ανάλογα με το υλικό και τις συνθήκες. Σύμφωνα με τα διαθέσιμα δεδομένα, ο ιός μπορεί να επιβιώσει για αρκετές ώρες έως αρκετές ημέρες σε διάφορες επιφάνειες. Ο χρόνος επιβίωσης μπορεί να ποικίλλει ανάλογα με τις συνθήκες, όπως η θερμοκρασία, η υγρασία και ο τύπος της επιφάνειας.",,1,1,1,2,3,2,,,
