query,intent_category,answer_1,answer_2,answer_3,completeness_1,factuality_1,usefulness_1,completeness_2,factuality_2,usefulness_2,completeness_3,factuality_3,usefulness_3
Μέχρι στιγμής επιτυγχάνουν τα εμβόλια το στόχο τους;,faq,"από τις 11 Απριλίου 2021, το COVAX υπολείπεται του στόχου του, έχοντας παραδώσει 38,5 εκατομμύρια δόσεις παρά τον στόχο των 100 εκατομμυρίων δόσεων μέχρι το τέλος Μαρτίου","Τα εμβόλια, από τις 11 Απριλίου 2021, δεν έχουν ακόμη επιτύχει πλήρως το στόχο τους λόγω της υποαπόδοσης του COVAX. Ωστόσο, ο ΠΟΥ έχει εγκρίνει αρκετά εμβόλια, όπως τα εμβόλια των Pfizer-BioNTech, Moderna, Sinopharm BBIBP-CorV, Οξφόρδης-AstraZeneca και Johnson & Johnson, τα οποία μπορούν να διανεμηθούν ως μέρος του COVAX. Ο ΠΟΥ στοχεύει να διασφαλίσει ότι όλοι όσοι διατρέχουν κίνδυνο σοβαρής νόσου ή θανάτου θα έχουν πρόσβαση σε αυτά τα ασφαλή και αποτελεσματικά εμβόλια το συντομότερο δυνατό. Η ολοκλήρωση του αρχικού σχήματος εμβολιασμού θα γίνει με το νέο εμβόλιο για τους ατελώς εμβολιασμένους πολίτες.","Το εμβόλιο κατά του κορωνοϊού έχει τα οφέλη που διαθέτει κάθε εμβόλιο το οποίο προστατεύει από ανεπιθύμητη ασθένεια. Ειδικότερα, με τον εμβολιασμό κατά του κορωνοϊού προκαλείται ανοσιακή απόκριση, με αποτέλεσμα να μειώνεται ο κίνδυνος κατά 90% ή και περισσότερο με τα εμβόλια mRNA, ενώ J&J Janssen το ποσοστό αποτελεσματικότητας του εμβολίου είναι περίπου 70%. Επιπλέον, οι πιθανότητες να μεταδώσεις τον ιό σε άλλους αφού εμβολιστείς μειώνονται, χωρίς ωστόσο να εξαλείφονται πλήρως. Θα σου πρότεινα, αφού συμβουλευτείς το γιατρό σου, να κλείσεις άμεσα ραντεβού για τον εμβολιασμό σου.",3,4,3,4,4,3,5.0,4.0,5.0
Η μάσκα προστατεύει μόνο από τον κορωνοϊό;,faq,Εφόσον χρησιμοποιείται σωστά προστατεύει από τη μετάδοση αναπνευστικών νοσημάτων που μεταδίδονται με σταγονίδια 3.,"Η σωστή χρήση της μάσκας προστατεύει από την μετάδοση αναπνευστικών νοσημάτων όπως ο COVID-19, συμπεριλαμβανομένων των σταγονιδίων. Η χρήση μάσκας είναι απαραίτητη για την προστασία τόσο των ατόμων που νοσούν όσο και των ατόμων που εμφανίζουν συμπτώματα λοίμωξης. Ωστόσο, είναι σημαντικό να σημειωθεί ότι ενώ οι μάσκες μπορούν να προσφέρουν προστασία, δεν είναι ο μοναδικός τρόπος προστασίας από τον ιό. Θα πρέπει να συνδυάζονται με άλλες πρακτικές, όπως η τήρηση αποστάσεων, η σωστή υγιεινή των χεριών και η αποφυγή στενής επαφής με άλλους. Επιπλέον, η παρατεταμένη χρήση ιατρικών μασκών μπορεί να είναι δυσάρεστη αλλά δεν οδηγεί σε δηλητηρίαση από CO2 ή έλλειψη οξυγόνου.","Η μάσκα προσφέρει προστασία από τη μετάδοση του κορωνοϊού. Η συστηματική χρήση μάσκας, βέβαια, προστατεύει από τη γρίπη, καθώς και από άλλες ιογενείς λοιμώξεις του αναπνευστικού συστήματος.",4,5,4,5,5,5,4.0,4.0,4.0
Πότε έχω ανοσία μετά το εμβόλιο;,faq,3,"Μετά το εμβόλιο COVID-19, η ανοσία συνήθως ξεκινά μέσα σε 2 εβδομάδες. Η διάρκεια της ανοσίας εξαρτάται από το εμβόλιο, αλλά συνήθως διαρκεί 6 μήνες έως 1 χρόνο. Αφού ολοκληρώσετε τη σειρά εμβολιασμού σας, μπορείτε να συνεχίσετε να λαμβάνετε το COVID-19. Μπορεί να χρειαστεί να κάνετε επιπλέον δόσεις ή να λάβετε διαφορετικό τύπο εμβολίου ανάλογα με τις οδηγίες από τους επαγγελματίες υγείας. Είναι σημαντικό να σημειώσουμε ότι τα εμβόλια COVID-19 δεν είναι 100% αποτελεσματικά, επομένως μπορεί να είναι πιθανή η επαναλοίμωξη. Ωστόσο, οι εμβολιασμοί μειώνουν σημαντικά τον κίνδυνο σοβαρών ασθενειών και θανάτων. Επιπλέον, τα επικαιροποιημένα εμβόλια κατά του κορωνοϊού μπορούν να χορηγηθούν την ίδια μέρα με το αντιγριπικό εμβόλιο, αλλά σε διαφορετικά σημεία.",Πλήρως εμβολιασμένος θεωρείσαι 14 ημέρες μετά τη δεύτερη δόση του εμβολίου δύο δόσεων ή τη μία δόση του μονοδοσικού εμβολίου.,1,2,1,5,4,5,3.0,4.0,4.0
μπορώ να ταξιδέψω στο εξωτερικό?,out_of_scope,"μπορεί να εξακολουθείτε να ελέγχεστε κατά την είσοδο ή την έξοδο από έναν τόπο, προορισμό ή χώρα.","Λαμβάνοντας υπόψη τις πληροφορίες που δόθηκαν, δεν είναι δυνατό να ταξιδέψετε στο εξωτερικό λόγω των ταξιδιωτικών περιορισμών και των κανονισμών ασφαλείας που έχουν τεθεί σε ισχύ λόγω της πανδημίας του COVID-19. Είναι σημαντικό να ακολουθείτε όλες τις οδηγίες και τις κατευθυντήριες γραμμές που παρέχονται από τις κυβερνητικές αρχές και να δίνετε προτεραιότητα στην ασφάλεια και την ευημερία σας.",,3,4,3,5,4,4,,,
Πού κάνουν τεστ για κορωνοϊό,out_of_scope,"Εθνικό Εργαστήριο Αναφοράς Γρίπης και λοιπών Αναπνευστικών Ιών Νοτίου Ελλάδος, Ελληνικό Ινστιτούτο Παστέρ 2. Κέντρο Αναφοράς Γρίπης Β. Ελλάδος, Β' Εργαστήριο Μικροβιολογίας Ιατρικό Τμήμα, Αριστοτέλειο Πανεπιστήμιο Θεσσαλονίκης","Το τεστ για κορωνοϊό μπορεί να γίνει σε οποιοδήποτε από τα παρακάτω εργαστήρια: 1. Εθνικό Εργαστήριο Αναφοράς Γρίπης και Λοιπών Αναπνευστικών Ιών Νοτίου Ελλάδος, Ελληνικό Ινστιτούτο Παστέρ 2. Κέντρο Αναφοράς Γρίπης Β. Ελλάδος, Β' Εργαστήριο Μικροβιολογίας Ιατρικό Τμήμα, Αριστοτέλειο Πανεπιστήμιο Θεσσαλονίκης.",,1,2,1,1,2,1,,,
Πού μπορώ να κάνω τεστ ιδιωτικά,out_of_scope,Όχι.,"Μπορείτε να κάνετε τεστ ιδιωτικά σε φαρμακεία ή άλλα κέντρα δοκιμών που προσφέρουν τεστ COVID-19. Δεν χρειάζεται να δηλώσετε τα αποτελέσματα των τεστ στις αρχές, αλλά είναι σημαντικό να ακολουθείτε τις οδηγίες του ΕΟΔΥ για την ιχνηλάτηση και την επιδημιολογική επιτήρηση.",,1,2,1,5,5,4,,,
Προκαλεί επακόλουθες επιπλοκές ο κορωνοϊός στους ασθενείς;,out_of_scope,"Ορισμένοι ασθενείς που έλαβαν αναστολείς του υποδοχέα IL-6 ενδέχεται να διατρέχουν υψηλότερο κίνδυνο για επιπλοκές και πρέπει να παρακολουθούνται στενά. Σε αυτούς περιλαμβάνονται οι ασθενείς που λαμβάνουν ταυτόχρονη ανοσοκατασταλτική θεραπεία, οι ασθενείς με επαναλαμβανόμενες χρόνιες λοιμώξεις ή υποκείμενες παθήσεις που τους προδιαθέτουν σε λοιμώξεις και οι οποίοι λαμβάνουν μακροχρόνια αναστολείς των υποδοχέων IL-6 για χρόνιες ιατρικές παθήσεις. Πόσο ακριβοί είναι οι αναστολείς των υποδοχέων IL-6;
Είναι ευρέως διαθέσιμα; Επί του παρόντος, το tocilizumab και το sarilumab είναι ακριβά και σε έλλειψη σε παγκόσμιο επίπεδο.","Ναι, ο κορωνοϊός μπορεί να προκαλέσει επακόλουθες επιπλοκές στους ασθενείς. Παράγοντες που αυξάνουν τον κίνδυνο σοβαρών επιπλοκών περιλαμβάνουν την ηλικία, την παχυσαρκία, την αρτηριακή υπέρταση και τον σακχαρώδη διαβήτη. Οι έγκυες γυναίκες με συμπτώματα διατρέχουν επίσης αυξημένο κίνδυνο εισαγωγής σε ΜΕΘ και αυξημένης πιθανότητας θανάτου. Οι έγκυες με Covid εμφανίζουν συχνότερα επιπλοκές της κύησης, όπως είναι ο πρόωρος τοκετός σε σύγκριση με τις έγκυες χωρίς Covid. Η ενδομήτρια μετάδοση είναι σπάνια. Ωστόσο, ορισμένοι ασθενείς που λαμβάνουν αναστολείς του υποδοχέα IL-6 ενδέχεται να διατρέχουν υψηλότερο κίνδυνο για επιπλοκές και πρέπει να παρακολουθούνται στενά. Οι επιπλοκές μπορούν να περιλαμβάνουν πνευμονία και σύνδρομο οξείας αναπνευστικής δυσχέρειας, θρομβοεμβολικά επεισόδια και το σύνδρομο μακρού COVID.",,1,4,2,5,5,5,,,
Ο εμβολιασμένος δεν θα τηρεί πλέον τα μέτρα προστασίας;,faq,Έχουν ανασταλεί λόγω κορονοϊού; Δεν υφίσταται αναστολή,Το κείμενο δεν παρέχει καμία πληροφορία σχετικά με το αν ο εμβολιασμένος δεν θα τηρεί πλέον τα μέτρα προστασίας.,"Αφού εμβολιαστείς θα πρέπει να εξακολουθείς να τηρείς τα μέτρα προστασίας από τον κορωνοϊό, καθώς ο εμβολιασμός δεν σημαίνει οτι δεν θα κολλάς ή μεταδίδεις τον κορωνοϊό, αυτό που αλλάζει είναι η μείωση της πιθανότητας σοβαρής νόσησης.",3,5,5,5,5,5,2.0,3.0,3.0
σε όλη τη χώρα πραγματοποιούνται οι εμβολιασμοί;,faq,2021,"Οι εμβολιασμοί σε όλη τη χώρα πραγματοποιούνται πράγματι. Σύμφωνα με τις πληροφορίες που παρέχονται, μέχρι τις 21 Νοεμβρίου 2021, συνολικά 71 χώρες έχουν χορηγήσει άδεια χρήσης του Sputnik V ενώ 1.2 δισεκατομμύρια δόσεις του εμβολίου παραγγέλθηκαν από διάφορες χώρες του κόσμου. Επιπλέον, τα εμβόλια RNA ήταν τα πρώτα εμβόλια COVID-19 που εγκρίθηκαν στις Ηνωμένες Πολιτείες και την Ευρωπαϊκή Ένωση. Αυτά περιλαμβάνουν το εμβόλιο Pfizer-BioNTech COVID-19 και το εμβόλιο Moderna COVID-19. Τα εμβόλια ιικών φορέων (non-replicating viral vector) όπως το CVnCoV RNA της CureVac αναμένουν επίσης έγκριση στην ΕΕ.","Οι εμβολιασμοί πραγματοποιούνται σε εμβολιαστικά κέντρα σε όλη την Ελλάδα, τα οποία είναι συνήθως νοσοκομεία ή κέντρα υγείας. Όταν κλείνεις το ραντεβού σου για εμβολιασμό, εντοπίζεις τα πλησιέστερα κέντρα με βάση τον ταχυδρομικό κώδικα της περιοχής σου. Εκτός από αυτό, παρέχεται και η δυνατότητα για κατ’ οίκον εμβολιασμό των ατόμων με δυσκολίες στην μετακίνηση.",1,5,1,1,5,1,4.0,5.0,4.0
Η κλιματική αλλαγή ευθύνεται για τον κορωνοϊό;,out_of_scope,Η κλιματική αλλαγή είναι μια σταδιακά αυξανόμενη πίεση που μπορεί να αποτελέσει την καθοριστική απειλή για τη δημόσια υγεία του 21ου αιώνα.,"Όχι, η κλιματική αλλαγή δεν ευθύνεται άμεσα για τον κορωνοϊό. Η κλιματική αλλαγή μπορεί να επιδεινώσει ορισμένες καταστάσεις, όπως η αύξηση της ζέστης και της υγρασίας, οι οποίες θα μπορούσαν ενδεχομένως να αυξήσουν τη διάδοση του COVID-19, αλλά δεν είναι ο λόγος πίσω από την εμφάνισή του. Το COVID-19 είναι μια μολυσματική ασθένεια που προκαλείται από έναν συγκεκριμένο τύπο κορωνοϊού, και η εμφάνισή του δεν μπορεί να αποδοθεί άμεσα στην κλιματική αλλαγή.",,1,5,1,5,5,5,,,
Μεταδίδεται ο κορωνοϊός από τα κατοικίδια ζώα;,faq,Διάφοροι τύποι κοροναϊών μπορούν να μολύνουν τα ζώα και να μεταδοθούν σε άλλα ζώα και ανθρώπους.,"Αν και ορισμένοι τύποι κοροναϊών μπορούν να μολύνουν τα ζώα και να μεταδοθούν σε άλλα ζώα και ανθρώπους, ο νέος κορωνοϊός, SARS-CoV-2, δεν μεταδίδεται από τα κατοικίδια ζώα. Είναι εξαιρετικά απίθανο τα κατοικίδια ζώα να διαδραματίζουν κάποιο ρόλο στην εξάπλωση του ιού. Τα κατοικίδια ζώα, όπως τα σκυλιά και οι γάτες, μπορούν να μολυνθούν από τους ιδιοκτήτες τους, αλλά δεν είναι γνωστό ότι παίζουν κάποιο ρόλο στην εξάπλωση του ιού. Ο ρόλος των ζώων συντροφιάς και των εκτρεφόμενων ζώων στην επιδημιολογία και τη μετάδοση της νόσου COVID-19 είναι επί του παρόντος άγνωστος.","Αν και δεν είναι σίγουρο ότι τα κατοικίδια, όπως είναι οι γάτες και οι σκύλοι, μεταδίδουν τον κορωνοϊό, είναι σημαντική η τήρηση των κανόνων υγιεινής στα ζώα συντροφιάς.",1,5,1,4,5,4,4.0,5.0,4.0
εάν έρθω σε επαφή με επιβεβαιωμένο κρούσμα κορωνοιος τι πρέπει να κάνω,out_of_scope,απομονωθείτε,"Βεβαίως! Θα χαρώ πολύ να βοηθήσω. Παρακάτω είναι η απάντησή μου στην ερώτησή σας:  Πρώτα απ' όλα, είναι σημαντικό να σημειώσουμε ότι εάν έρθετε σε επαφή με επιβεβαιωμένο κρούσμα κορωνοϊού, θα πρέπει να ακολουθήσετε τις οδηγίες του Κέντρου Ελέγχου και Πρόληψης Νοσημάτων (CDC) και των τοπικών αρχών υγείας. Οι οδηγίες αυτές μπορεί να διαφέρουν ανάλογα με την περιοχή και τη σοβαρότητα του κρούσματος. Σε γενικές γραμμές, εάν έρθετε σε επαφή με επιβεβαιωμένο κρούσμα κορωνοϊού, θα πρέπει να ακολουθήσετε τα παρακάτω βήματα:  1. Παραμείνετε σε αυτοαπομόνωση για 14 ημέρες από την τελευταία επαφή με το κρούσμα.",,2,2,2,3,2,3,,,
Τα εμβόλια βοηθάνε στο να τελειώσει η πανδημία;,faq,Τα εμβόλια εκπαιδεύουν το ανοσοποιητικό μας σύστημα να δημιουργήσει πρωτεΐνες που καταπολεμούν την ασθένεια,"Τα εμβόλια δεν βοηθούν στο να τελειώσει η πανδημία, αλλά συμβάλλουν στη μείωση της επίπτωσης του ιού στον πληθυσμό. Η πανδημία COVID-19 θα τελειώσει τελικά όταν επιτευχθεί συλλογική ανοσία μέσω της φυσικής λοίμωξης ή των εμβολιασμών. Τα εμβόλια εκπαιδεύουν το ανοσοποιητικό σύστημα να δημιουργήσει αντισώματα κατά ενός συγκεκριμένου ιού, προστατεύοντας τα εμβολιασμένα άτομα από το να προσβληθούν από την ασθένεια και να μεταδώσουν το παθογόνο. Αυτό συμβάλλει στη μείωση του φορτίου του ιού στον πληθυσμό, αλλά δεν τελειώνει από μόνο του την πανδημία. Η πανδημία θα τελειώσει όταν επιτευχθεί συλλογική ανοσία, η οποία μπορεί να επιτευχθεί μέσω της φυσικής λοίμωξης ή του εμβολιασμού.","Ο εμβολιασμός μπορεί κατ’αρχάς να αποτρέψει τις δραματικές συνέπειες της πανδημίας, όπως τους θανάτους. Τα εμβόλια προστατεύουν από τη βαριά νόσηση και σε πολλές περιπτώσεις μπορούν να αποτρέψουν την ίδια τη λοίμωξη. Σύμφωνα με τον Παγκόσμιο Οργανισμό Υγείας, εάν μέχρι τα μέσα του 2022 έχει εμβολιαστεί το 70% του παγκόσμιου πληθυσμού τα οφέλη θα είναι πολλαπλά αλλά κυρίως θα περιοριστεί η εμφάνιση νέων μεταλλάξεων και η πανδημία θα οδηγηθεί στο τέλος της.",2,5,3,5,5,4,4.0,5.0,5.0
Κινδυνεύουν οι ηλικιωμένοι από επιπλοκές που σχετιίζονται από κορωνοϊό;,out_of_scope,"οι ηλικιωµένοι άνω των 80 ετών που θα νοσήσουν από τον ιό COVID-19 µπορεί να βρεθούν αντιµέτωποι µε πολύ σοβαρές και επικίνδυνες για την ζωή τους επιπλοκές, εφόσον νοσήσουν, ιδιαίτερα όταν έχουν υποκείµενα παθολογικά προβλήµατα, όπως καρδιολογικά, αναπνευστικά, σακχαρώδη διαβήτη, νεοπλασίες.","Ναι, οι ηλικιωμένοι διατρέχουν μεγαλύτερο κίνδυνο από επιπλοκές που σχετίζονται με τον κορωνοϊό. Σύμφωνα με τις παρεχόμενες πληροφορίες, οι ηλικιωμένοι άνω των 80 ετών που θα νοσήσουν από τον ιό COVID-19 μπορεί να βρεθούν αντιμέτωποι με πολύ σοβαρές και επικίνδυνες για την ζωή τους επιπλοκές, ιδιαίτερα όταν έχουν υποκείμενα παθολογικά προβλήματα. Αυτές οι επιπλοκές μπορεί να περιλαμβάνουν πνευμονία, σύνδρομο οξείας αναπνευστικής δυσχέρειας, θρομβοεμβολικά επεισόδια και το σύνδρομο μακρού COVID. Επιπλέον, οι ηλικιωμένοι διατρέχουν μεγαλύτερο κίνδυνο σοβαρών επιπλοκών από τον COVID-19 σε σύγκριση με νεότερους ανθρώπους, και ο κρύος καιρός και το χιόνι δεν μπορούν να σκοτώσουν τον νέο κορωνοϊό ή άλλες ασθένειες.",,4,5,4,5,5,5,,,
Μήπως συνέχεια θα φορέσουν μάσκες πάντα;,out_of_scope,"Εάν το COVID-19 κυκλοφορεί ευρέως και επηρεάζει το σύστημα υγείας, οι επισκέπτες, μαζί με τους εργαζόμενους στον τομέα της υγείας και της φροντίδας και τους φροντιστές, θα πρέπει να φορούν πάντα μια καλά προσαρμοσμένη ιατρική μάσκα σε όλους τους κοινόχρηστους χώρους και όταν φροντίζουν ασθενείς που δεν είναι ασθενείς με COVID-19,","Όχι, οι μάσκες δεν θα φορούνται συνέχεια. Οι μάσκες θα φορούνται μόνο από επισκέπτες, εργαζόμενους στον τομέα της υγείας και φροντίδας, και φροντιστές σε εγκαταστάσεις υγειονομικής περίθαλψης όταν το COVID-19 κυκλοφορεί ευρέως και επηρεάζει το σύστημα υγείας. Οι φροντιστές μπορεί να επιλέξουν να φορέσουν μια μάσκα σε ένα παιδί αν το παιδί έχει επαφή με ένα άτομο που διατρέχει υψηλό κίνδυνο να αναπτύξει σοβαρή ασθένεια ή αν βρίσκεται κοντά σε κάποιον που είναι άρρωστος. Τα παιδιά ηλικίας 5 ετών και κάτω δεν χρειάζεται να φορούν μάσκα.",,5,2,4,2,3,4,,,
Πού μένει για καραντίνα κάποιος μετά την άφιξή του στο αεροδρόμιο Αθηνών;,out_of_scope,"Εάν ταυτοποιηθείτε ως επαφή, θα πρέπει να προβείτε σε καραντίνα, πράγμα που σημαίνει ότι θα απομονωθείτε από τους άλλους στο νοικοκυριό σας","Με βάση τις πληροφορίες που παρέχονται, τα άτομα που φτάνουν στο αεροδρόμιο Αθηνών θα πρέπει να μένουν σε καραντίνα για 14 ημέρες από την τελευταία τους επαφή με επιβεβαιωμένο κρούσμα. Θα πρέπει να παραμένουν χωριστά από τους άλλους στο νοικοκυριό τους και να επικοινωνούν με τις τοπικές υγειονομικές αρχές για να μπουν με ασφάλεια σε καραντίνα. Εάν δεν μπορούν να βρίσκονται σε ξεχωριστό δωμάτιο, θα πρέπει να μένουν τουλάχιστον ένα μέτρο μακριά από τους άλλους. Θα πρέπει να έχουν αρκετή τροφή, νερό και έναν τρόπο επικοινωνίας με τους άλλους.",,3,3,3,4,3,3,,,
